<?xml version="1.0" encoding="UTF-8"?>
<!ELEMENT DEMO (EMAIL*)*>
<!ELEMENT EMAIL (TO, FROM, CC*, SUBJECT, BODY)>
<!ELEMENT TO (#PCDATA)>
<!ATTLIST TO
	title ID #IMPLIED
>
<!ELEMENT FROM (#PCDATA)>
<!ELEMENT CC (#PCDATA)>
<!ELEMENT SUBJECT (#PCDATA)>
<!ELEMENT BODY (#PCDATA)>
